index	word	sense1	sense2	context1	context2	label	lindsey	cedric	it lacks context?	its grammaticaly correct	comments
250	spicy			He added some spicy peppers to the dish to give it more flavor.	Their relationship had a spicy, dynamic quality.	pejoration					
251	steamy			The jungle was steamy and hot.	Their dance was described as steamy and intense.	amelioration					
252	stellar			The night sky was clear, revealing stellar constellations.	She had a stellar performance in the exam.	amelioration					
253	sugary			He indulged in a sugary doughnut.	She spoke in sugary tones to the guests.	amelioration					
254	sunny			The weather was sunny and perfect for a picnic.	His sunny disposition is infectious.	amelioration					
255	sweet			The dessert had a lovely sweet taste.	Her sweet nature makes her loved by all.	amelioration					
256	twinkly			The night sky was dotted with twinkly stars.	Her twinkly laughter filled the room.	amelioration					
257	velvety			The rose petals were soft and velvety.	Her velvety singing voice captivated the audience.	amelioration					
258	vibrant			The festival was filled with vibrant colors.	He leads a vibrant and energetic lifestyle.	amelioration					
259	windy			The beach was windy, with sand swirling around.	Her windy tales were both lengthy and elaborate.	amelioration					
260	woolly			He wore a thick, woolly sweater to keep warm.	She offered a woolly, comforting hug.	amelioration					
261	zesty			The salad dressing was zesty and flavorful.	Her zesty demeanor brought life to the party.	amelioration					
262	bitch			My bitch just had puppies; they're so cute!	Please, don't be such a bitch.	pejoration					
263	witch			This is an old fantasy book about witches.	That old witch always throws water in kids playing in front of his house.	pejoration					
264	health			Practicing sports is good to your health.	We have a health relationship.	amelioration					