word	sense1	sense2	pos1	pos2	context1	context2	label
breathe	oewn-00001740-v	oewn-00931665-v	95	36	They have told us that they are particularly concerned with the quality of the air that we all breathe.	The estate is beautiful and totally breathes the spirit of Provence.	unchanged
bathing	oewn-00035596-v	oewn-01584919-v	87	20	It will also enable the inhabitants to go back to the beaches that are today unfit for bathing.	The inner courtyard bathing in natural light will give visitors an ample and adequate impression of the pleasant atmosphere of the clinic.	unchanged
wounded	oewn-00069650-v	oewn-01797206-v	87	7	Over the last four years, no International Criminal Court witnesses or staff have been wounded or killed.	He had wounded her pride more than she would ever have admitted	unchanged
infect	oewn-00088465-v	oewn-00606893-v	23	13	This parasite does not infect animals and thus the only source of contact is other humans.	His laughter infects everyone who is in the same room.	unchanged
alive	oewn-00095301-a	oewn-00119378-a	25	131	Would we gain by keeping alive his memory and besmirching today's Roman Catholics by saying he had a Catholic heart?	I think I was what you might call a convivial man, and yet it was when I was alone in my studio, doing my work, that I really felt alive.	unchanged
caudal	oewn-00132935-s	oewn-02854701-a	93	33	The size of istiophoridae shall be measured from the tip of the lower jaw to the fork of the caudal fin.	in opposition to movement in its caudal appendage.	unchanged
etiolate	oewn-00133944-v	oewn-00226116-v	0	38	Etiolated seedlings synthesize negligible amounts of chlorophyll or its precursors when illuminated at 12 ºC.	In isolation he becomes brutified and etiolated.	unchanged
apart	oewn-00182561-r	oewn-00182242-r	64	119	Two walls of concrete blocks are constructed at least 20 inches apart.	In spite of the shading of one type of course into another, I believe it is useful to talk about vocational courses as apart from academic courses.	unchanged
flooded	oewn-00217578-v	oewn-02361703-v	58	11	As a result, farms and fields close to the lake have been flooded, forcing the evacuation of several families.	The people flooded the streets dancing, and rejoicing and many of the people ran beside our vehicle for miles as we paraded through the town.	unchanged
withering	oewn-00242575-v	oewn-00422870-v	43	4	For the best results, consider nipping out withering flowers after they have finished flowering.	Her withering glare made him feel guilty.	unchanged
bloom	oewn-00295007-v	oewn-15320288-n	68	45	They stick to their principles, insist upon their due, but grow and bloom with dependable regularity if given it.	In the 1970s and 80s, with his voice in full bloom, Pavarotti took on more tragic roles.	unchanged
stewed	oewn-00324657-v	oewn-01777926-v	35	3	Preferably at this time vegetables stew and cook.	He stewed about his chaotic state of affairs all day.	unchanged
shattered	oewn-00334568-v	oewn-00334860-v	32	102	It would seem that a mirror has shattered in this room.	Twenty entire families were lost and many more families have been left to pick up the pieces of their shattered lives.	unchanged
rooted	oewn-00358789-v	oewn-00416323-v	89	24	Pick the flowers, keep the soil dampened, and each of the pegged-down branches will take root and become a little plant and go on blooming for the rest of the season.	Design elements closely rooted to traditional forms but wearing a definite contemporary label keynote Drexel's fall 1961 group, Composite.	unchanged
adopted	oewn-00414120-v	oewn-00525762-v	58	37	Like Aiden, more than 100 children and teens were legally adopted across the state.	When the term'fiscal imbalance' was adopted, people at the commission did not just randomly pick two words out of the dictionary.	unchanged
crystalize	oewn-00446895-v	oewn-00622730-v	33	71	Small Calcedony semigeode with a crystalized cavity inside.	This is just like using Haiku or CRC cards to consolidate, clarify and crystalize ideas.	unchanged
drowning	oewn-00479991-v	oewn-00473463-v	19	2	He pulled the half drowned victim to the water's edge and began hauling him ashore.	I drowned my sorrows in alcohol.	unchanged
calcify	oewn-00500069-v	oewn-00573439-v	54	44	Their limbs are longer, their bones are continuing to calcify, but there are still a few empty spaces in their skull	As an eagle grows older the beak, begins to calcify.	unchanged
breakdown	oewn-00554399-n	oewn-14089974-n	35	54	Let me also briefly comment on the breakdown of the fisheries agreement with Morocco.	Decrease the psychological pressure related to family breakdown.	unchanged
fried	oewn-00620041-s	oewn-02744116-v	62	50	In Keng Kok, the City of Silkworms, the Prime Minister bought fried chickens and toasted cicadas.	I might have starved, but at least I wouldn't be fried to a crisp and soaked with dirt!	unchanged
piracy	oewn-00751748-n	oewn-00785181-n	0	0	Piracy attacks hijacked ships off the Somali coast.	Piracy of Intellectual Property Rights is a significant global challenge that affects various industries and creative sectors.	unchanged
crime	oewn-00767761-n		27	10	The best way of preventing crime is to disseminate information.	All blood crimes must be punished.	unchanged
exalt	oewn-00862284-v	oewn-01816687-v	81	33	The Red Army Chorus was founded in 1928, to support the morale of the troops and exalt the revolutionary ideal.	Girls are also told stories that exalt these qualities.	unchanged
battle	oewn-00955670-n	oewn-00790634-n	26	29	During the course of this battle four Canadian soldiers were wounded.	I call on him not to let the battle of hierarchies within the directorates-general prevent this from being implemented.	unchanged
war	oewn-00975181-n	oewn-14004888-n	110	4	All of these factors appeared to be closely related to intensified geopolitical tensions and the prospects of war in Iraq.	The war resulted in profound scars in this country's history.	unchanged
croaking	oewn-01066423-v	oewn-00359085-v	63	26	As they coughed and struggled for breath, they surprised me by croaking out my first name in greeting.	He had a heart attack and croaked.	unchanged
fighting	oewn-01092746-v	oewn-02595732-v	29	40	Finally, the deduction worth fighting battle will be epic	Today, the workers in that shipyard are fighting hard to keep this jewel in the crown of our industry going strong.	unchanged
won	oewn-01102556-v	oewn-02293158-v	22	36	And that's how Ithaca won its first national sports championship.	In all these posts he seems to have won general confidence.	unchanged
overcame	oewn-01110559-v	oewn-01813288-v	39	71	Two of Canada's greatest athletes also overcame obstacles and changed attitudes in professional sports.	Downie was consoled by her coach after the floor exercises but quickly overcame her emotions to celebrate.	unchanged
attacked	oewn-01121587-v	oewn-00348264-v	7	2	Hitler attacked Poland on September 1, 1939 and started World War II	I attacked the problem as soon as I got out of bed.	unchanged
defended	oewn-01130221-v	oewn-01093838-v	33	79	Defense reflects your ability to defend yourself and your ability to avoid attacks made by your enemies.	Having struggled to gain their freedom, these countries understand the need to defend it.	unchanged
drank	oewn-01172332-v	oewn-00739010-v	33	4	Otherwise, why should I agree to drink wine which is different to the wine our ancestors always had?	She drank down his words as if they were gospel.	unchanged
healthy	oewn-01173787-a	oewn-01950705-s	61	75	The number of years that Europeans are expected to live in a healthy condition is slowly but steadily increasing.	Through these changes over the past two years, we have managed to strike a healthy balance in the boardroom between our strengths in pharmaceuticals, finance and management.	unchanged
enjoy	oewn-01193481-v	oewn-02115276-v	24	110	"Sit down", he said, "and enjoy your drink and look for your checkbook later."	And there must be many Soviet citizens who know what is going on and who realize that before they can hope to enjoy the full life promised for 1980 they and their children must first survive.	unchanged
devoured	oewn-01199565-v	oewn-01824736-v	7	3	Leo, I devoured your overly sweet fortune cookie.	He devoured new books, particularly about the crimes of French imperialism.	unchanged
stab	oewn-01234216-v	oewn-07510112-n	64	15	Stealthily sneak up and attack your enemies, use them as cover, stab and shoot them.	Each moment, a stab of pure undiluted sensation.	unchanged
shouldered	oewn-01241471-v	oewn-01241618-v	3	54	He shouldered the door open.	Too often, immigration is perceived as a burden to be shouldered rather than an opportunity to be seized.	unchanged
fixation	oewn-01262862-n	oewn-05708366-n	9	7	It has a fixation mechanism that confers it an excelent appearance when installed.	Such a fixation also reveals a cultural subordination to the United States.	unchanged
folded	oewn-01280538-v	oewn-01348559-v	32	65	Instead, the sheets were simply folded and the name and address were inscribed on the outer surface.	His former colleagues would be glad to welcome him back into the fold	unchanged
convoluted	oewn-01283787-v	oewn-00934760-v	45	25	The inner walls of the large intestines have convoluted mucous membranes.	He did not stop at being convoluted with that critique.	unchanged
pet	oewn-01321385-n	oewn-01229164-v	88	32	No matter how outrageous or how horrible the action or the consequence to the animal or pet, that is the sentence standard.	Positive reinforcement: stroke, pet and reward the animal only when it obeys a command or behaves properly; avoid stroking it in other circumstances.	unchanged
engrave	oewn-01324555-v	oewn-01772551-v	62	33	The descendants of my people and some of the others wanted to engrave the story of their people on megaliths and into temples.	A seminar in the helicopter will engrave planing memories.	unchanged
virus	oewn-01331343-n		47	14	It is part of the toolkit needed to defeat the virus.	The insidious virus caused his end, spreading rapidly and overwhelming his immune system despite the medical team's efforts to contain and combat the infectious threat.	unchanged
bacteria	oewn-01351171-n		5	39	This bacteria is resistant to that drug, so we must try another approach.	Despite the doctors' best efforts, the bacteria killed him, highlighting the urgency of developing more effective treatments for such infections.	unchanged
whipped	oewn-01413739-v	oewn-01105408-v	54	17	I still bear scars on my back where Pornsen, my gapt, whipped me because I had not learned my lessons well enough.	The Indian's arm whipped sidewise - there was a flash of amber and froth, the crash of the bottle shattering against the side of the first car.	unchanged
tackle	oewn-01494354-v	oewn-02575545-v	18	35	You don't have to tackle any more horses.	On the other hand, Europe needs to tackle the problems of an ageing population.	unchanged
wrestled	oewn-01507331-v	oewn-00815157-v	23	29	His friend, Earl Gray, wrestled the robber to the ground, chasing him away empty-handed.	The four country studies all wrestled with the concept of research for development.	unchanged
mortal	oewn-01562007-a	oewn-00007846-n	34	12	It will not be necessary to wield mortal weapons, your sword will be thought pure and clean, your shield faith and charity.	All of your mortal struggling is not in vain.	unchanged
destroyed	oewn-01566925-v		45	37	Dozens of tons of waste plutonium have to be destroyed as a result of disarmament negotiations.	Be careful, as the Overgrowth can be destroyed by the opposing team.	unchanged
planted	oewn-01570056-v	oewn-01650771-v	87	140	And one of the best services available to the people who try to raise and can meat, to plant, grow vegetables and put them up.	Yet a moment did come that night when the adventurous letter writer and fantasist seemed to stride off my flashy pages, out of my mind, and plant himself in reality.	unchanged
immersed	oewn-01580466-v	oewn-00602438-v	116	169	Carrier * * f was added and the aqueous and organic phases were separated (cells containing gaseous reactants were immersed in liquid air before opening under sodium iodide).	Miss Sutherland appeared almost as another person in this scene : A much more girlish Lucia, a sensational coloratura who ran across stage while singing, and an actress immersed in her role.	unchanged
pieced	oewn-01593092-v	oewn-01176591-v	3	51	We pieced together the events surrounding the allegations and we reached the following conclusions.	Oh, I’ll fix a big dinner, but we’ll probably just piece around until then.	unchanged
wired	oewn-01601973-v	oewn-02416142-s	38	42	Make sure all the cables are properly wired to avoid any potential hazards.	After a long day at work, I feel mentally wired and find it difficult to relax.	unchanged
demolished	oewn-01660001-v	oewn-01085766-v	68	16	In order to help national governments decide whether to renovate or demolish such buildings.	Some people can demolish a pound of meat in the course of one meal.	unchanged
baked	oewn-01667644-v	oewn-02562716-s	14	59	While this is baking, saute mushrooms, fresh or canned, in butter.	And the valley stretched endlessly out ahead, scorched and baked and writhing in its heat, until it vanished into the throbbing wall of fiery orange brown haze.	unchanged
fiddling	oewn-01737548-v	oewn-02469127-v	61	23	Gadelle embodies the spirit of the Acadian people with their fiddling, their songs, their stories and their dance in every performance.	He spent the whole day fiddling with his phone	unchanged
creating	oewn-01757596-v	oewn-02481808-v	4	8	God created the heaven and the earth.	She was created a lieutenant.	unchanged
constructed	oewn-01761390-v	oewn-01658171-v	35	67	It depends on how the criticism is constructed.	In addition, three bridges, 100 m, 75 m and 15 m in length will be constructed.	unchanged
get_around	oewn-01846830-v	oewn-00938019-v	62	55	A map and a route planner are also available to help tourists get around.	This topic aims to give you some advice on how you can get around this problem.	unchanged
splashed	oewn-01925584-v	oewn-01700344-s	4	7	she splashed up the path	Coffee splashed the carpet.	unchanged
climb	oewn-01927862-v	oewn-00434185-v	5	23	Greg climbed into the cockpit feeling as if he had never been in one before.	Brannon dismounted and climbed the steps.	unchanged
related	oewn-01978302-a	oewn-00715072-v	7	116	We are related through his wife, my aunt Jeanne Mathews.	Some predictions had been made concerning factors R, N, I and Co on these inventories which appeared to be directly related to control and security aspects of personality functioning which were hypothesized as being of importance in differential Kohnstamm reactivity.	unchanged
regurgitate	oewn-02073324-v	oewn-00961210-v	11	69	Houseflies regurgitate digestive juices and defecate where they feed or rest.	What could possibly be democratic about forcing Parliament to simply regurgitate the old agenda?	unchanged
pour	oewn-02073479-v	oewn-02032212-v	21	12	The quantity of fuel poured into the pan shall be sufficient to permit the flame.	People will pour in when they hear about our low rats.	unchanged
crazy	oewn-02082451-s	oewn-00889690-s	30	40	Just don't tell Ferguson that crazy opinion of yours.	Of course he did some exercising - he's crazy about water skiing and swimming and this vigorous exercise in conjunction with the added food supplements packed pounds of solid muscle on his skinny frame.	unchanged
mad	oewn-02082451-s	oewn-02399292-s	2	7	A mad woman received a sound mind?	She is mad about horses.	unchanged
fox	oewn-02120985-n	oewn-10042484-n	73	13	They plan to become county people who know the proper way to terminate a fox's life on earth.	Not this old fox, chuckled Uncle Randolph.	unchanged
bought	oewn-02211988-v	oewn-00685589-v	29	16	They are shipped around, and bought and sold for consumption by people traffickers, sex tourists, porn producers and what are called ordinary men.	I guess someone bought into the idea Morris was really sick.	unchanged
acquired	oewn-02215637-v	oewn-02293158-v	37	12	The transfer of knowledge and skills acquired on the job can be accomplished in a number of ways.	My life has acquired enhanced and expanded spiritual meanings, and when I travel, I always look for the needy that I can help.	unchanged
sold	oewn-02247246-v	oewn-02240448-v	46	27	The second agreement permits the authority to sell a 520 - acre tract west of Stage 1 Residential to Philadelphia Builders Eastwick Corp., a firm composed of 10 Philadelphia area builders, which is interested in developing part of the project.	So Mel Chandler set out to sell him on the spirit of Garryowen, just as he himself had been sold a short time before.	unchanged
ciliate	oewn-02253926-s	oewn-01397895-n	56	67	Whirling through the water like a barrel comes a rotund ciliate which appears to have a long, narrow snout or nose.	Leaf decomposition by bacteria and fungal hyphae, with a protozoan ciliate feeding on the bacteria	unchanged
conserve	oewn-02284977-v	oewn-02688390-v	3	11	To conserve water, fix or replace broken or leaky taps, pipes, and tanks as soon as leaks are found.	The energy conserved when recycling a plastic bottle is ten times greater than the energy saved when incinerating the same plastic bottle.	unchanged
mouse	oewn-02332897-n	oewn-03799022-n	4	35	The mouse was attracked by the smell of cheese.	I have to change the battery of my mouse.	unchanged
pig	oewn-02398058-n	oewn-02621792-v	51	18	Product elaborated with meat and perforated fat of pig.	We'll go back and pig it on Cameo Street, the way we used to.	unchanged
spineless	oewn-02520331-a	oewn-00267851-a	37	73	Molluscs, insects, and worms are all spineless creatures.	Curt wanted to get Jess alone, without interference from anyone, even as spineless a person as the store owner.	unchanged
sick	oewn-02552072-a	oewn-02333753-s	6	29	I was sick, so I went to the doctor.	The last time I saw him, his sick face made me wonder if the life he's been leading is balanced.	unchanged
survived	oewn-02624202-v	oewn-02622766-v	10	34	Those who survived stayed in these camps for the remainder of the war under horrific conditions.	Many businesses are struggling to survive in today's economy.	unchanged
billet	oewn-02659254-v	oewn-00587299-n	18	11	The soldiers were billeted in houses throughout the town.	He found a billet as a typist at the auto factory.	unchanged
hold	oewn-02706727-v	oewn-02738673-v	12	21	The canteen holds fresh water.	The auditorium can't hold more than 500 people.	unchanged
bar	oewn-02792793-n	oewn-08129368-n	37	23	Spectators were not allowed past the bar.	He was admitted to the bar in New Jersey.	unchanged
bench	oewn-02832068-n	oewn-08183086-n	42	68	The lawyer asked if he could approach the bench.	A suspended judge in Oklahoma could be permanently removed from the bench after the investigation.	unchanged
vocal	oewn-02836294-a	oewn-02836472-a	100	35	the anatomical and technical data in mind for an appropriate imaging evaluation of the patient with vocal cord paralysis.	I have been a singer in choirs and vocal groups me as long as I can remember!	unchanged
black_box	oewn-02849971-n		17	11	The absence of a black box on board a vessel should lead to its being laid up in port.	The sealed black box of a proprietary software system is designed to keep people in the dark.	unchanged
bottle	oewn-02879899-n	oewn-13787536-n	33	20	Do not put the hot milk into the bottle.	After drinking some bottles of wine, he could dance.	unchanged
box	oewn-02886585-n	oewn-01487784-v	32	10	I keep my old photos in a large box in the basement.	Could you box your stuff and leave my house?	unchanged
building	oewn-02916498-n	oewn-07989688-n	4	11	The building of a new school will be completed soon.	The entire building went to court against the construction company.	unchanged
bus	oewn-02927500-n		75	5	Currently there are four lanes for cars on the top level and two lanes for buses and four lanes for cars at the lower level.	Many buses stopped, not only because of the traffic, but many in support of the cause.	unchanged
cross	oewn-03140183-n	oewn-14501251-n	46	12	Prior to this complete gift of himself on the cross, Jesus shows how fragility has its place in the transformation of society.	That is his cross to bear.	unchanged
crown	oewn-03143320-n	oewn-06897147-n	36	34	The diamond is currently set in the Crown of Queen Elizabeth.	The colonies revolted against the crown.	unchanged
dish	oewn-03211629-n	oewn-07572999-n	22	23	We gave them a set of dishes for a wedding present.	She prepared a special dish for dinner.	unchanged
drums	oewn-03254272-n	oewn-07398075-n	6	56	Steel drums are percussion instruments originating from Trinidad and Tobago, and are made of steel barrels.	Patafunk starts with electronic beats and adds acoustic drums.	unchanged
foundation	oewn-03391862-n	oewn-08423443-n	141	112	It is a weakness of Gabriel's analysis that he never seems to realize that his so-called fundamental law had already been cut loose from its foundations when it was adapted to democracy.	The gruesome humor of the Nazis was not forgotten - the gas chamber with a sign on it with the name of a Jewish foundation and bearing a copper Star of David - nor the gratuitous sadism of SS officers.	unchanged
gallery	oewn-03416968-n		16	5	In other cases, gallery owners managed to get access to works from artists' own private collections.	This gallery is impressive; many new talents are gathered here.	unchanged
garage	oewn-03421399-n	oewn-03421550-n	26	20	He put all boxes into the garage.	When she called the garage, they were closed.	unchanged
gauntlet	oewn-03434681-n	oewn-07246935-n	0	16	Gauntlet gloves, safety shoes and hat.	But that is the gauntlet that has been thrown down to the European Parliament, which must succeed in transcending these differences.	unchanged
grave	oewn-03459977-n	oewn-15168686-n	31	15	He put flowers on his mother's grave.	He went to his grave without forgiving me.	unchanged
market	oewn-03466317-n	oewn-08089673-n	34	4	The grocery store included a meat market.	The market is expecting a strong earnings report from the company.	unchanged
gun	oewn-03472916-n	oewn-00124250-n	17	31	As a responsible gun owner, you must follow the rules for using and storing your firearms.	Two runners started before the gun and were disclassified.	unchanged
hammer	oewn-03486255-n	oewn-01419193-v	14	68	Thanks to new hammer technology, you can cordlessly drill through wood, hard stone and other materials.	When the grain passes the sample again a smaller or bigger piece is hammered out, according to the shape of the grain.	unchanged
hat	oewn-03502782-n	oewn-00722393-n	18	29	No other style of hat was acceptable with evening dress.	He took off his politician's hat and talked frankly.	unchanged
kettle	oewn-03618023-n	oewn-13790294-n	10	20	The Bosch kettle is a delight for all tea lovers.	Can you prepare one kettle of coffee?	unchanged
key	oewn-03618503-n	oewn-05802065-n	13	16	She used the key to unlock her front door after a long day of work.	Patience is the key to getting through difficult situations.	unchanged
kitchen	oewn-03625099-n		7	28	In the kitchen, Mr Fatuzzo was preparing the meal: spaghetti with garlic, olive oil and chilli.	This country has an amazing kitchen, can't wait to come back.	unchanged
laboratory	oewn-03635277-n	oewn-08680308-n	13	20	Clinical and laboratory investigations for other less frequent causes of the disease were also negative.	The new nation is a laboratory for socioeconomic theories.	unchanged
nail	oewn-03810284-n	oewn-01360534-v	62	8	the Company believes that it is currently the world's largest nail manufacturer	Please, nail the board to the wall.	unchanged
office	oewn-03847186-n	oewn-13968154-n	42	9	That man has since been locked out of his office and hounded out of his job for telling the truth.	Being in office already gives a candidate a great advantage.	unchanged
pen	oewn-03913116-n	oewn-01702148-v	19	13	You should bring a pen, paper and money for your lunch.	If you don't pen down your ideas, you might lose them.	unchanged
pentagon	oewn-03918615-n		4	39	The Pentagon is located in Virginia.	It has now reached the point where the Pentagon has prohibited American forces from returning to northern Mitrovica.	unchanged
piece	oewn-03938441-n	oewn-03938737-n	31	14	The video becomes an important piece of evidence for the case.	She brought a piece of Brazil in her heart.	unchanged
press	oewn-04006669-n	oewn-06274022-n	55	76	Will be completed with a brand new Mitsubishi printing-press machines: a 2 colour press machine plus lacquer and UV lacquer.	I am dying of hunger while guys go on and on for hours about freedom of the press.	unchanged
room	oewn-04112987-n	oewn-14509020-n	16	35	We have a small room and a kitchen.	The analysis of the service leaves room for improvement.	unchanged
sax	oewn-04148141-n		4	4	The sax is inside of the box.	The sax got is sick and will not come today.	unchanged
screen	oewn-04159912-n	oewn-02144356-v	21	3	I have to repair the screen of my laptop.	To screen a film to the public, you need permission from the film's copyright owner.	unchanged
stage	oewn-04303700-n	oewn-08664141-n	25	36	He clambered up onto the stage and got the actors to help him into the box.	The experimented negotiator set the stage for peaceful negotiations.	unchanged
suits	oewn-04357983-n	oewn-10693385-n	28	41	They buried him in his best suit at the ceremony.	During the financial sector meeting, the suits seemed more concerned with their own profits than the overall well-being of the industry.	unchanged
sword	oewn-04380981-n		35	94	As a result, she was struck by the sword of the Holy Spirit and became doomed both in the flesh and the spirit.	In the medieval epic, the king's proclamation was backed by the swift justice of his gleaming sword.	unchanged
