word	sense1	sense2	pos1	pos2	context1	context2	label
underpin					More than that, it seems highly likely that the social science aspects of environmental problems will underpin the actions of governments and international agencies.	But they will take into account the need for that balance that says that social spending without underpinning by economic growth will not be sustained in any event.	unchanged
identify					Whether attempting to construct a database of resources for use in planning responses to nuclear emergencies, developing optimal routes for scheduling the safe transport of hazardous substances, or monitoring the health implications of a disaster, GIS can assist in identifying possibilities and formulating solutions.	THIS expanded network of popular committees and institutions making up the Unified leadership is infused by tens of thousands of activists who belong to, or identify with, the different factions of the PLO.	unchanged
stumble					In the passage, she stumbled and almost fell, then flung back the door to the bedroom.	They didn't want the Yanks stumbling in and screwing up in an attempt to force the issue.	unchanged
enable					The British were involved with them through us and it was their advanced work on breaking cyphers that enabled the ring to establish such a great record.	The Government will also encourage more family doctors to hold budgets to buy services for patients, and is looking at ways to enable smaller practices to team up to secure the advantages of fund holding.	unchanged
deny					Scott was so pleased with the style he had evolved at Battersea, a treatment that humanised industrial forms without denying their function, that he also used it on the Guinness Factory at Park Royal, west London.	The same thing happened in 1984 when the province was denied a fixture against the Wallabies.	unchanged
constitute					The development of the Somerset AEC both accords with and constitutes a practical example of the Home Office's recent guidance to sentencers :	Such measures constituted the present Government's heritage, when it took office in 1979.	unchanged
add					If we add to A the gradient of a scalar function, the resulting vector A' still gives the same magnetic field because formula.	The boat's wrap-around windscreens were made of black polarised glass which only added to Dream Baby's ugly air of menace.	unchanged
check					We have only a limited capacity for checking the accuracy of many environmental monitoring results, let alone of predictions.	He stood, door in hand, checked by something in the way his visitors, a man and a woman, were standing.	unchanged
represent					While criticized by many on the grounds that it had few teeth and represented a compromise between the DoE and all other departments (notably those of Agriculture and of Transport), it was none the less a major achievement.	They represent a time when either their objects were not the same as those of the official organization, or the CCO was not enterprising enough to suit them.	unchanged
run					He stopped on the embankment, shaking with cold and shock, to note the spot, then fled along the tractor paths, the dog running with him, to the stables where the ten o'clock children's ride was in its closing stages.	Yeah the Stratford Warriors running about every six weeks something like that.	unchanged
march					We thought they were like any other wartime group, nothing more than reminiscences and marching songs.	Both women looked at him in joint appeal and he marched to the door, pulling it open with unnecessary force.	unchanged
save					This has been a constant theme of Intifada policy : that we wish to build (Palestine), not to destroy (Israel); that we wish to achieve freedom (for our people), not to deprive others (Israelis) of it; that we wish to protect and save lives (ours), not to endanger the lives of others (Israelis).	It's just that I'm saving.	unchanged
treat					This is not to suggest that motorists should be treated differently.	Last week he promised to supply us with a written explanation of the way his company had treated Debbie, but it never arrived.	unchanged
recover					You know, but erm he he's recovered reasonably well in the same, you know, but	But the worst happens and you reel from it, you stagger, the shock is enormous, and then you begin to recover.	unchanged
divide					Zeigler divides the public hazards into those which result from the production of raw materials and manufactured goods, those which originate in transport and transmission and those which threaten the public in their role as consumers.	And on that one is er, sixty three shared by nine six time sixty three divided by nine	unchanged
step					So here he was, a distinguished public man, also an artist of a kind, stepping obediently through Room I (French 1880s) and Room II (British 1880s and 1890s), on a lead grey morning, to the pale grey, classical, quiet place where the bright light shone and sang off pigment so that the phrase, miraculous stuff, seemed merely accurate.	Only once had he returned after they all left and that had been bad enough, like a dream no, like stepping into the set and scenario of some frightening film, a Hitchcock movie perhaps.	unchanged
send					And erm we sent it to well one of my other sons in Australia there and he was thrilled to bits.	Finally, after the third month passed with no rent received, Debbie phoned the tenants, asked them to pay her directly, and sent Landlords a recorded-delivery letter, which was returned, and finally one by ordinary post stating that Landlords were no longer employed as the managing agents.	unchanged
prevent					But it should be possible to create and enforce enough common rules to prevent the absurd see-sawing of industrial relations legislation we have seen since 1969.	Neither the Butler Education Act of 1944, nor the introduction of comprehensive schools, prevented a high proportion of children from under-achieving.	unchanged
smile					Theresa smiled and then nodded with serious satisfaction in a moment of grave feminine conspiracy.	beginning careers, well it is in a catalogue, the book is in a catalogue, yeah, so there's a front cover of the book sitting in the catalogue smiling at her, saying please buy this book of Christopher.	unchanged
list					The operator may deviate from the listed procedure because it may require excessive moving about or because he is interrupted by the requirements of other tasks.	Esso filling stations have a free booklet listing most models produced since 1980, as does the charity Clear (01-387 4970), with more detail available in the Unleaded Petrol Guide (Autodale, Ì´å£2.99).	unchanged
oppose					Mr Cook argued that 10 years of Thatcherism had been forced on most people, who had never voted Conservative, and that many of those who opposed PR in the Labour Party wanted to use the same undemocratic power to ram socialism down the throats of a majority who didn't vote for it.	The rhetoric of the Tehuana opposes the nihilism of traditional feminisations of colonial trauma, and asserts the potential of a dignified cultural resistance.	unchanged
coordinate					As may be seen in Fig. 3.1 the coordinates of the wire element are x', y', z', whereas the coordinates of the point where we wish to determine the magnetic field are set of coordinates.	Day care in each area would be organised and coordinated through the children's day centres which would also provide information, support and resources to parents.	unchanged
alienated					The imagery of the black bomber, used in Handsworth was extended to the notion that there were groups of alienated and criminalized young blacks who saw the riots as a chance to engage in an orgy of looting.	Hale's eyes stare knowingly at the viewer, a human sacrifice to an alienated and consumerist culture.	unchanged
inherit					Lewis asked him if he could remember the day when he heard he had inherited Wyvis Hall and had walked in here and astounded them with his news.	There will be the reality of the economic situation which we inherit, which will not be our fault, but it will be our responsibility.	unchanged
float					Standing by the swimming pool at Saracen, Miranda beckoned to Adam, who was floating on the water in a transparent blow-up plastic armchair.	Oldham took up the attack again and Barlow, who had a fine match at left-back, totally containing Rocastle, floated in a deep cross beyond Winterburn.	unchanged
use					After Handsworth part of the press response was to blame the riot on rivalry between West Indians and Asians, and even after the arguments were criticized by local residents; and community leaders, they were used to explain' what happened.	Some peaks of demand can be dealt with by using consultants, but they tend to be expensive and do not always fit well with ill-defined but important factors such as the favoured style of the organisation.	unchanged
reverse					On an impulse he reversed the Jaguar and drove quickly back to Martyr's Cottage.	The objective is to revise and almost reverse the traditional accountancy concept of man-power as a resource consuming factor requiring regular payments, overheads in the form of heated, lighted, equipped workspaces and so on.	unchanged
derive					The infilling sandstone is derived from the fossil soil over which the root was growing.	The document, and the legislation that derived from it, pointed to a positively discriminatory approach : with both central and local government supplementing existing programmes in such a way as to strengthen local economies, as well as the physical and social environment.	unchanged
spend					Mr Smith said in an interview on BBC television's On the Record that he did not expect his colleagues to spend and spend again' when they took office.	I'm not going to spend a week on the route	unchanged
place					Parents had fought for this as a local resource to prevent the need for children to be placed in long-stay placements far from home.	When, in 1939, The Architects' Journal conducted a survey to find what were considered the best modern buildings in Britain, Battersea was placed second and was the favourite of such unlikely celebrities as Sir Kenneth Clark, Rebecca West and Charles Laughton.	unchanged
speak					When they drew up beside the little band it was Alice Mair who opened the car door and spoke.	The feet of the sauropod are small (relatively speaking !), with short, stubby toes, yet animals that walk on soft mud tend to have spreading feet to distribute their weight more evenly.	unchanged
design					Hobeika and Jamei (1985) describe the MASSeVACuation (MASSVAC) simulation software designed to analyse and evaluate traffic evacuation plans given a natural disaster in an urban area.	It seemed strange to make that argument, Mr Cook said, when it was clear the whole policy review process was designed to placate the centre ground.	unchanged
arise					The monitoring network has become known as the radioactive incident monitoring network (RIMNET) and has, as its prime responsibility, the detection of abnormal increases in radiation levels within the UK of the kind that might arise from an overseas nuclear accident.	While the first wave of popular interest arose with the 1982 Whitechapel exhibition instigated by Laura Mulvey and Peter Wollen, it was the publication of Hayden Herrera's biography of Kahlo in 1983 which has led to her current cult status.	unchanged
negotiate					you'd have to negotiate on that one with Mr and Mr.	She negotiated a free catalogue.	unchanged
pass					They were unlikely to be in real danger, the Whistler stalked at night, not in broad daylight, and no vehicle had passed him since he left the coastal road.	Finally, after the third month passed with no rent received, Debbie phoned the tenants, asked them to pay her directly, and sent Landlords a recorded-delivery letter, which was returned, and finally one by ordinary post stating that Landlords were no longer employed as the managing agents.	unchanged
exploit					Mooneyhan (1988) has described the progress of the pilot stage of GRID which culminated in approval for a full operational phase; GRID is now involved in integrating, storing and exploiting a variety of global environmental databases, mostly acquired from NASA.	Given the already appalling and growing rate of homelessness and lack of hostel facilities in London, when more people than ever will not only have to endure the freezing nights of the coming winter on the streets, but perhaps permanent homelessness, it was terrible to see the situation being exploited for a joke by your advertisement : Just the thing now the evenings are drawing in.	unchanged
meet					He was in luck, and fixed to meet Andy Barton at Brazzo's where Yeo Davis had a table permanently booked.	They must have gone a good two miles before they met another car.	unchanged
satisfy					He must therefore satisfy himself on a regular basis that it does not constitute a statutory nuisance.	We found there that by choosing a scalar function in the form formula we could automatically satisfy the other equation for the electric field strength, formula.	unchanged
perceive					But common sense may have been more important than learning in perceiving the vulnerability of most castles to battering-rams and catapults; for even in 1100 they were, as a rule, primitive structures.	Geoffrey Martel had perceived the propaganda potential of public war as early as the mid eleventh century; later it enabled Henry the Liberal of Champagne to claim the military service of all lords within his county, a reapplication of the Carolingian ban.	unchanged
stuck					Adam had Hilbert's old golf-bag stuck between his legs and Rufus guessed the gun was inside it.	In Four Saints Thomson's informality was given free reign since he first of all improvised the music at the piano then, when it stuck, wrote it down to a figured bass.	unchanged
impose					That proposal, if implemented, would shift almost all the decision-making in homicide cases from the trial to the sentencing stage : the only issue of any consequence in most cases would be the sentence to be imposed, and all the distinctions now drawn at the stage of criminal liability would be reflected in the sentence alone.	If causing death is to be regarded as the most serious harm that can be inflicted, it would seem to follow that the most blameworthy form of homicide should result in the highest sentences imposed by the courts.	unchanged
serve					Hughey, you serve him !	In 1983 the Home Secretary imposed restrictions on the release of persons serving life for murders of police- and prison-officers, terrorist killings, murder during robbery, and the sadistic or sexual murder of young children, fixing a minimum of twenty years' imprisonment for these offenders.	unchanged
tackle					After 16 minutes Graham Roberts was injured by a tackle for which Perry Groves was booked (Steve Clarke took over as sweeper, and is likely to have several weeks in which to build on a promising display).	Task forces, meanwhile, were directed to tackle youth unemployment.	unchanged
open					Alright, I can open this up, I got the little box, there you are, just a minute and, oh Charlotte, oh you are a menace, there you are, now you be quiet for a minute will you ?	Clare managed to open the Red Rocking Horse by mid-May.	unchanged
demonstrate					In these sections punishment will be understood to mean the infliction of pain and the review of the project will seek to demonstrate that the probation practice described is not only more demanding but also more effective than this traditional understanding of punishment.	A major, though often ignored, work by Kahlo demonstrates the cultural politics underlying her art.	unchanged
outline					He traced the contours of her face with gentle fingers, outlining the curve of her mouth, stroking her temples.	While the entire network of popular committees, local institutions and the general public constitute the field commanders in the battle of civilian disobedience and of constructing a political infrastructure, a rotating Unified National Command acts in the role of field-general, issuing a bi-monthly directive outlining policy and determining specific resistance programmes.	unchanged
clutch					Ahead of him, trudging along on the left of the path, was a little group of children, the eldest girl wheeling a pushchair with two smaller children, one each side of her, clutching the bars.	 I said, dear, Winston Churchill  The second woman tugged free of the clutching fingers.	unchanged
arrange					This fossil bark is typified by its lozenge-shaped leaf scars arranged in spiral rows.	The selectors knew they were playing with fire when they decided to arrange a couple of club fixtures and they have duly been consumed in a conflagration of their own making.	unchanged
separate					Each of these may be further subdivided and the typology shown in Fig. 10.1 draws upon the classic work of Burton and Kates (1964) in separating geophysical from biological hazards and Zeigler et al. (1983) in distinguishing public (or what we might call societal) hazards from private (individual) ones.	Interwoven with these images are subtler references to the metaphorical borderlines which separate Latin American culture from that of Europe and North America.	unchanged
convey					The differentiation of accidents from other types is useful in the context of emergency planning and is not so clearly conveyed by other hazard typologies.	As an extempore speaker he was able to tailor his words to his audience's reactions and so convey the impression of personal conversation even when addressing thousands.	unchanged
choose					Under pressure from Satra, Kirov told singers to choose between the companies.	For Kahlo, however, choosing to don the costume of the Tehuana, as for example in Tree of Hope (1946) (Fig. 8), was to embody a powerful icon of cultural identity.	unchanged
allow					Sorge was annoyed with himself, irritated that he had allowed the Intelligence man to get under his skin.	FROM this month, all new cars submitted for British type approval, the test which allows them to be legally sold in the UK, must be able to run on lead-free petrol.	unchanged
sort					I mean I'm not saying he's alcoholic but he goes out with the lads and he you know he'll he'll sort of thud up the stairs.	I did manage to sort out the food for tomorrow and	unchanged
substitute					I'd like to substitute Paul Littlejohn for myself in the power of attorney that I hold on your behalf, Elinor.	Substituting the above equation into eqn (3.1) we get formula, or using the vector relation (eqn (A.6)) we obtain the modified form formula.	unchanged
rise					Muldoon rose immediately from his enormous black leather chair to greet him, coming from behind the vast desk with hand outstretched.	Neither, at first, did the incoming administration foresee the impact of rising unemployment, which was to be especially serious among the urban young.	unchanged
shock					I was shocked for a minute.	But now she was visibly shocked by the drained and haggard-looking face which kissed her.	unchanged
act					The DoE, through Her Majesty's Inspectorate of Pollution (HMIP), was given the task of co-ordinating a national response plan, installing the radiation monitoring network and acting as lead government department in an emergency (HMSO 1988).	It's not ethical as they are acting for the landlord, he says.	unchanged
close					Without another word she went back into the kitchen then came out to him, closed the front door after her without locking it and got into the car.	The trees had grown up beside it in the twenty-five years since the railway had closed, and the boy stopped every now and then to watch small birds hopping around the top branches.	unchanged
protect					Elinor sometimes thought of all the love and the hatred, the treachery and the killing that this hall had undoubtedly seen, when strong men fought hand-to-hand to the death, to protect their women and children.	Sometimes, too, houses have to be sold by auction to satisfy the legal requirements of trustees or executors (auctions provide adequate proof that the property has been sold at the going market value, and protect trustees from future claims of negligence).	unchanged
finance					Doctors are worried that women turning to prostitution to finance the habit are at risk of contracting Aids.	Another was the transformation of many such bodies, already heavily subsidized from public funds, into de facto agencies of the state, which financed them and indirectly determined their policy.	unchanged
deal					In reply Roy Hattersley supported the call for the immediate suppression of street violence, but warned that the roots of such riots could not be dealt with until all people felt they had a stake in British society (ibid. : cols. 1407åäÌÝÌÕ9)	The second time round they dealt with R. and B. Lettings in London NW10, who they instructed just to find a tenant.	unchanged
greet					Muldoon rose immediately from his enormous black leather chair to greet him, coming from behind the vast desk with hand outstretched.	Its vast walls of flint and glass and Gothic tracery were brilliantly floodlit and the churchyard cat, sleek and black as tar, greeted us querulously and led us right round the church and through the gravestones at the back, glimmering and pale in the moonlight.	unchanged
slump					To her relief, Elinor was not slumped on the floor; deathly white, she clung for support to the silver brocade hangings of her bed.	As they set up the now empty suit with its back to the door, half slumped over a control panel, he settled down behind the curtained entrance of the showers.	unchanged
risk					We should know something about the periodicity of the variables we are monitoring if we are not to risk either unnecessarily detailed data collection or aliasing of trends;	Risking the dismay of circuit engineers some theoreticians do, in fact, refer to eqn (3.35) as Ohm's law.	unchanged
minimize					There can be little doubt that a GIS approach has wide applicability in all sorts of location problems where the goal is to minimize (rather than, as conventionally, maximize) accessibility to a population.	Conservative instincts were, of course, to minimize within the partnership state involvement and expenditure, relative to that of private enterprise.	unchanged
shake					Adam stopped and shook his head.	He had metaphorically shaken a large fist, impotently, at some looming energy-field, and got on with his work, his work.	unchanged
miss					They ought to have pocketed three points in the first half-hour but Tony Adams, a more threatening centre-forward on his forays than the current Alan Smith, missed the target with two headers and David Rocastle let Dave Beasant save a penalty, much as the stretch-version keeper had done for Wimbledon in the 1988 FA Cup final.	but think what you missed	unchanged
surround					A first time garden is usually small and certainly the typical one I am imagining for this series is no more than 40ft x 20ft and surrounded on all sides by other houses.	It is the mythology surrounding the women wearers of the costume which directed Kahlo's choice.	unchanged
participate					Responding to the Handsworth events Douglas Hurd was moved to argue forcibly that such events were senseless and reflected more on those who participated in them than on the society in which they took place : The sound which law abiding people in Handsworth heard on Monday night, the echoes of which I picked up on Tuesday, was not a cry for help but a cry for loot (Financial Times, 13 September 1985).	FISA was then a relatively unimportant body which organised European and other championships and participated in the running of Olympic regattas.	unchanged
determine					However, the Pope's account of the role of the papacy went a great deal farther than that : Christian unity, he said, must be founded on the faith in Christ that was handed on by the Apostles; what this faith is must be determined by the Roman Catholic Church.	Penny, sounding childishly, sullenly determined, broke into her mother's thoughts.	unchanged
confirm					Forster was sorely tempted to nip out and confirm that the noise was coming from George by twiddling the volume and tuner, but fought down the urge.	Broadly, the survey confirmed that parents of children with special needs had not been given a real choice of placement, and that they had to fight hard for mainstream provision if this was their choice.	unchanged
reveal					There is a poignant irony in the way clothing, which on one level served to hide Kahlo's broken body, falls or is lifted by the model to reveal a luxuriantly perfect physique (Fig. 4).	The fascination with functions of the body, the analogies between artistic and physical creative processes, self-portraiture used to reveal the female body as the site of patriarchal aesthetic discourse; all of these mirror the concerns of many women painters of the 1980s.	unchanged
lose					Shah (1983) made a comprehensive investigation of natural disaster reports for the period 1974åäÌÝÌÕ80 and concluded that both disaster frequency and magnitude (measured in terms of lives lost) are increasing.	The colonised body which Kahlo clothed in revolutionary idealism has lost its function as a symbol of nationhood becoming instead an icon of female suffering.	unchanged
attain					After the next change in dynasty, Thierry and Philip of Alsace strengthened their shaky claim to the comital position by attaining for themselves the prestige attached to being the outstanding crusaders of their generation.	This specimen is 15 cm long, but roots have been found which attain a length of 14 metres !	unchanged
