word	sense1	sense2	pos1	pos2	context1	context2	label
graft			70	34	Builders, architects and union officials, who provided information on graft during a six-week investigation by The New York Times into corruption estimated to cost $25-million a year.	Approximately 75 percent of organ grafts (transplants) from a blood relative survive and function for at least a year and around 50 percent of cadaver kidneys do as well in the recipient.	changed
ground			25	36	The earthquake shook the ground beneath their feet, causing panic.	After a long debate, they decided to find common ground to settle their differences.	unchanged
head			23	4	They say he gives good head.	There are 200 head of cattle on this farm.	changed
head			22	119	We came down from the head waters of the St. John as far as Woodstock, and thence by stage and steamboat routes. "	The leaders of the poaching rings are in Nairobi, some 185 miles to the south of here, according to Mannasses Keiller, head of Kenya's Anti-Poaching Mobile Unit, a fiveyearold body that has more than 50 employes.	changed
hit			3	9	We hit Detroit at one in the morning but kept driving through the night.	The ball hit the fence.	changed
hold			23	12	To carry well, i.e. to hold the head high, with arching neck.	This theory holds for all irrational numbers.	changed
implement			0	3	Implement a procedure.	He implemented a new economic plan.	changed
induct			24	21	There was a ceremony to induct the president of the Academy.	The young geisha was inducted into the ways of her profession.	changed
infiltrates	oewn-01917700-v	oewn-01917356-v	86	70	If it should fall into the water, take it out immediately and check that no water has infiltrated	In fact, that is what I did when investigating the Camorra, because I infiltrated the network.	unchanged
land			175	169	I heard again the war-horse come, Like gathering tempest, big and black, That through the forest wings its track, Sweeping and tearing all that stand, And desolating wood and land.	His imaginary rights above his duties, and his happiness above his virtue, who are encouraged by selfish and time-serving politicians and are doing much mischief in the land.	changed
lane			47	15	It is in the Cowboys' practice field on Forest Lane in north Dallas.	I stood in the lane until the final echo of the wheels vanishedrattling in the distance.	changed
lift			0	0	Lift potatoes gently to avoid bruising or damaging the skins. Use your fingers to harvest potatoes if need be.	Lift my spirits.	changed
light			34	14	Although he saw it in a different light, he still did not understand.	Do you have a light?	changed
loss			31	26	The match ended in their first loss of the season.	The company operated at a loss last year.	changed
mean			40	14	The sky is red this morning — does that mean we're in for a storm?	My ex-husband means nothing to me.	changed
mount	oewn-01927367-v	oewn-00434185-v	16	49	They decided to mount the horse, but without experience, it was a mistake.	As the deadline approached, his anxiety began to mount.	unchanged
mouth			19	19	New York is at the mouth of the Hudson.	The jar had a wide mouth.	changed
multitude			59	53	He found himself numb of lip and soul as he stood with the multitude of hooded men before the altar in the greatest of the Courts: in the blue dimness of incense and	As children, we appreciated especially the unsparing multitudes of other children in the 11.6inerstadt.	changed
number			6	19	Every number has a unique position in the sequence.	He has an unlisted number.	changed
number			50	30	In English the subject and the verb must agree in number.	I hope to become one of their number before I die.	changed
office			12	13	A municipal office.	He rented an office in the new building.	changed
order			16	30	IBM received an order for a hundred computers.	The machine is now in working order.	changed
ounce			55	14	Never have brought back the bag, and stolen merely two ounces.	To this add 4 ounces of bay rum and 1 ounce of castile soap shavings.	changed
part			12	53	The central part is almost wholly uninhabited, and covered with primitive forests, which are visited only by hunters and lumberers.	Frank took the Doctor to his home, resolved never to part with so faithful and gallant a friend, whose faults had been the faults of unfortunate circumstances, but whose heart, he felt assured, was' in the right place.'	changed
part			27	4	He tried to sing the tenor part.	His part was right in the middle.	changed
pay			0	0	Pay attention to.	Pay an obligation.	changed
peel	oewn-01265500-v	oewn-01262515-v	13	25	She began to peel the orange, its citrus scent filling the air.	The paint in my house is peeling off.	unchanged
performance			28	21	We congratulated him on his performance at the rehearsal.	The play ran for 100 performances.	changed
pin			159	68	He cut a sapling and carved a spear point, long and white; confronting the wolf, he drove the raw white wood into its chest as it came up at him and fought to pin it to the ground and grind the pain out of it.	Other sources said the investigators plan to call witnesses who can pin down the date and details of the " hush money " payment to H, Howard Hunt on March 21, 1973, including a " mystery man " who helped the special prosecutor establish the date.	changed
plane			9	48	Moulding planes are used for sticking mouldings, as the operation of forming mouldings with the plane is called.	will be no difference between the shadow on the plane, and the side of the prism which projects that shadow; and if the plane be entirely deprived of light, by the extensive breadth of the shadow, the side of the prism will in general be darker than the shadow on the plane: but this will depend very much on the situation of other objects.	changed
play			0	4	Play with her feelings.	She plays on her clients' emotions.	changed
player			101	94	He became the first man in history to win unanimous selection as the National League's Most Valuable Player.	A popular Judge, " says the great Bacon, " is a deformed thing; and plaudites' are fitter for players than for magistrates.	changed
prop			35	132	Back in his Tokyo apartment, Toshi props the snapshot up and he draws his father.	Our ship was hit several times (two holes in left wing flaps, several in fuselage, severed oil line in number three engine and bent prop).	changed
pull			4	4	The pull up the hill had him breathing harder.	The pull of the moon.	changed
pull			27	0	You'll be sent home if you pull another stunt like that.	Pull your knees towards your chin.	changed
quilt			117	71	The chamber was large, covering an area occupied by three rooms on the ground floor; and being next to the roof, the quilt could be conveniently attached to the rafters by ropes.	To this day it is a marvel to me how any one could arrange pillows and quilts to make such a nondescript appearance as mine now presented.	changed
rag			143	152	She could stand the faded pastel smear on the peeling wallpaper in there, and she could stand the faint reddish stain on her mother's cleaning rags.	Whatever may be the determination of the poor cultivator in bearing hunger, that he may face his other xvarits, he is in general naked, or covered with rags, transmitted in the family from generation to generation.	changed
record			78	26	mask and runs his operation like a Cecil B. DeMille production, upped his own record to 526.28 mph, wrecking his racer but becoming the first person ever to be timed over 500 in a wheeled vehicle on land.	This is a little over the record of Dr. Tanner, but the result is very different.	changed
relationship			10	72	Where the relationship of blood has ceased, do we cease to acknowledge that general bond which unites all men of every nation?	Mirax and I put this free time to good use, rebuilding our home and our relationship, but with that came some consequences that I saw as incredibly disruptive -- on the scale of Thrawn disruptive.	changed
reversal			12	4	There was a reversal of autonomic function.	The reversal of the image in the lens.	changed
rise			0	13	Rise to a challenge.	The building rose before them.	changed
risk			94	50	It is to save bloodshed, and you all from a horrible fate, that I have ventured hither at the risk of my life.	You would stifle the thought, immediately, at the risk of suffocation; for in her sober senses, any rational woman would do this, as a matter of religious duty.	changed
rock	oewn-09438954-n	oewn-10554923-n	21	31	She skipped a smooth rock across the surface of the lake.	In difficult times, he was her rock, always reliable and strong for her.	unchanged
root	oewn-13145876-n	oewn-08524579-n	50	14	The carrot is a type of vegetable that grows as a root under the soil.	Jupiter was the root of the radiation.	unchanged
run			6	13	Don't run that software unless you have permission.	he called each flip of the coin a new run.	changed
sail	oewn-01850600-v	oewn-01873556-v	15	53	The small boat sailed smoothly across the lake, guided by a gentle wind.	After years of preparation, she was finally ready to sail into uncharted territories of her research.	unchanged
savage			62	88	soft-yellow room; throw rug on the floor; colored pictures of savage and saint taped on the wall above her head.	Aside from one or two pleasant arias and one superb septet, there is very little in the Savage that suggests its composer's grand reputation.	changed
score			11	4	Settling a score.	The score was 7 to 0.	changed
score			53	55	He tried to blame the victim but his success on that score was doubtful.	Police believe the killer was a gang member settling a score with a rival gang.	changed
seed	oewn-11704458-n	oewn-05843082-n	14	4	She planted a seed in the pot, covering it gently with soil and watering it.	The seed of doubt was planted in his mind, and he couldn't shake the feeling off.	unchanged
september_11	NA	oewn-15325294-n	61	76	Barbara is going on maternity leave for 3 months starting in September 11.	The country possesses an intense immigration flow and, since the attacks of September 11, its immigration procedures became more rigid.	unchanged
sink	oewn-01989937-v	oewn-01976145-v	18	42	He let the dishes sink into the warm, soapy water before beginning to wash them.	The reality of the situation didn't truly sink in until much later.	unchanged
spark	oewn-07426910-n	oewn-13795739-n	9	27	A single spark from the campfire landed on the dry leaves, threatening to ignite.	Their conversation was the spark that ignited a lifelong friendship.	unchanged
stab			69	108	There was not a taxi to be had, or a light to be seen except for the stab of searchlights and the flashes of anti-aircraft batteries.	A young man with a thin mustache appeared to be pushing himself against this woman, and Megan felt a sudden stab of violation.	changed
stay			3	7	To stay a flat sheet in a steam boiler.	Please stay the bloodshed !	changed
stream	oewn-09471510-n	oewn-08478606-n	8	18	A clear stream flowed gently through the forest, its waters cool and refreshing.	He had a constant stream of ideas that never seemed to end.	unchanged
stroke			43	31	Then Dave Wain demonstrated with big, easy strokes, and in no time, we had five huge logs to use.	Verify brake cylinders shaft's stroke, comparing with the specifications established by the vehicle assembler. 	changed
support			29	24	The statue stood on a marble support.	The government provides support to the arts in several ways.	changed
tell			9	0	He could tell that she was unhappy.	Ellen told Helen about the situation.	changed
time			28	9	He was a great actor in his time.	He had a time holding back the tears.	changed
tip			69	20	Included are all the standards (speed, average speed, maximum speed, tip distance, odometer, auto stop/start timer, average speed indicator and clock).	I would've liked to tip back my head, but I dared not take my eyes off Barnes.	changed
touch			23	33	The local Mafia won't touch gambling.	Are you all right? You've hardly touched your lunch.	changed
touch			22	40	This dish could use a touch of garlic.	With the lights out, she had to rely on touch to find her desk.	changed
trading	oewn-01093829-n	oewn-00080218-n	9	20	They are trading drugs in the subways.	Some types of legal trading can appear to be based on the misuse of inside information.	unchanged
tree			7	19	As the tree increases in size, the roots near the body exhaust the soil of nutriment, and the absorbents, or fibrous spongioles, become hardened by age, and incapable of action.	In this way, every tree provides an insight into the history of its growth.	changed
turn			23	6	In Vermont, the leaves turn early.	Ivory turns well.	changed
twist			105	31	I want you to take your index and middle fingers on both hands, bend them at the knuckle, then pinch and twist.	That would certainly put a new twist on things, wouldn't it?	changed
unit			14	2	The team is a unit.	A unit of wheat is a bushel.	changed
wall_street	oewn-09145446-n	oewn-08090304-n	59	70	We must not blame it all on the "bad guys" that operate in Wall Street.	Despite the controversy, many experts note that it is not unusual for Wall Street to take part in deals not open to ordinary investors.	unchanged
wave	oewn-07366790-n	oewn-07367435-n	4	2	The wave crashed against the shore, its foam reaching the tips of their toes.	A wave of nostalgia hit her as she sifted through the old photographs.	unchanged
way			9	5	A lonely way of life.	Make way for.	changed
way			16	12	Didn't know the way home.	It's a long way to Moscow.	changed
word	oewn-07155367-n		31	34	There was a strong exchange of words on the situation. 	Before the world was created, the Word already existed; he was with God, and he was the same as God.	changed
walk	oewn-00284412-n	oewn-04552265-n	0		Walking is a healthy form of exercise.	After the blizzard he shoveled the front walk.	unchanged
book					I really loved this fantasy book.	He was in luck, and fixed to meet Andy Barton at Brazzo's where Yeo Davis had a table permanently booked.	unchanged
disappear					And yet he'd disappeared, without trace.	The DDI's smile disappeared.	unchanged
want					Isobel wants some coffee.	It may be clipped classical, random cottage, modern high-tech, or some intensely personal vision of Byzantium, that no one has ever imagined before, but which exists in your head and wants to get out.	unchanged
grind	oewn-01597899-v 	oewn-05101686-n			My grandmother buys beans and grinds her own coffee.	Do you prefer a thin or coarse grind of coffee?	unchanged
salmon	oewn-02537365-n	oewn-00380866-s			I will cook a salmon for the dinner today.	I like salmon ties.	unchanged
fail					Can't fail to be entertaining.	As for public protection, this depends on executive decisions with regard to release; it fails to take into account whether it is necessary for public protection to keep lifers in for so long.	unchanged
go					How much was he going to tell her ?	Anything goes fast after Friday.	unchanged
win					Up until that news hit the Committee, Don had won the day with his UK Vehicle Division proposals.	Chelsea might have won had the ball not kept turning into a Mexican bean at Kerry Dixon's feet.	unchanged
pour					The Englishman nodded and poured himself more coffee.	Faced, however, with the catastrophic increase in unemployment and the need to occupy large numbers of workless people without directly employing them (which would have run counter to the economic doctrine which had led to the redundancy of many of them in the first place), the Government poured money into any voluntary agency willing to put in a bid for government-funded cheap labour.	unchanged
demand					I demanded.	Like any house that's demanding, idiosyncratic, small and truly experimental, it's in trouble $150,000 in the red, with the serious prospect of closing.	unchanged
say					The armed robber might say that he had no intention of using the firearm, that he carried it with him simply to frighten the victim, and that it went off accidentally : if the jury believes that, should he be convicted of murder ?	only other one he's got is a silk one so er I was gon na go on Tuesday and have a look and they had them there before Christmas, seven ninety nine and, but it said one size now I don't know whether the one size will fit Di because the last one I had for him I sent away for and I had erm so I don't know whether them down there would fit, they were seven ninety nine, there were white and lemon and pale green that was striped I think.	unchanged
bear					Hill expresses the way time has cheated them : his daughter was born while he was remanded in custody, and is now 14 : She would change dramatically and I didn't feel a change in myself mentally.	As a baby, she was fascinated by the Mothercare Catalogue, and so The Baby's Catalogue, which documents the paraphernalia of the infant's small world in minute detail, was born.	unchanged
get					That's getting in the	They've been to his little boy's primary school, interviewed the teachers and headmistress and all the school friends and everything just trying to get a dirty story.	unchanged
take					He was unsurprised to find her packed off firmly to take his sister home, leaving him as a person of major importance in what he instantly assumed to be a real murder.	Had either of the teams won, they would have taken the League leadership.	unchanged
buy					Why didn't you want to buy the same one again mum ?	It might buy you the time you need.	unchanged
render					It was a substantial, two-storey, L-shaped house standing to the east of the track with walls partly flint and partly rendered, enclosing at the rear a courtyard of York stone which gave an uninterrupted view over fifty yards of scrub to the grassy dunes and the sea.	Here, in our view, is a classic case of the absence of a geographical input rendering the data of limited value.	unchanged
let					Let us hope that G1S can, in some small way, help mitigate the suffering and hardship felt by all those afflicted by the effects of hazards which, as we have learnt with bitter recent experience in the UK, can occur in an untimely fashion in the most improbable of places.	You are letting this disappointment and that's all it is, you're still a very well-off young woman get in the way of everything.	unchanged
bother					Even if lead levels in the atmosphere do not bother you, I am sure you will find the fact that unleaded petrol is 15p cheaper, and that diesel fuel boosts mpg by at least a third, most interesting.	I suppose some people might say to them oh you're being nosy but then that doesn't bother me because you don't tell them what you don't want them to know.	unchanged
turn					Precautions will not conquer empires, they will not build great cities, they will not transmute dreams into gold or carry men across wide oceans, and precautions will not, emphatically not, win fair ladies, and here he turned to Ellen and lasciviously dropped his gaze to her long bare legs.	Now, however, it seems, the wheel has turned full circle.	unchanged
inform					Sir David English was not informed of the visit and in consequence had no plans to attend the Ideal Home Exhibition that day, the official statement announced.	These ideas were informed by a paper which had already been produced by an active member of the local Mencap group, who had previously tried to generate the debate within the Community Health Service through the Mencap committee.	unchanged
preserve					The outline of the soft parts are also clearly displayed, so that the animal has been preserved almost in frozen motion.	This fish is preserved in a fine-grained limestone which preserved most of the skeletal details of the fish (but not its colours).	unchanged
see					Given the already appalling and growing rate of homelessness and lack of hostel facilities in London, when more people than ever will not only have to endure the freezing nights of the coming winter on the streets, but perhaps permanent homelessness, it was terrible to see the situation being exploited for a joke by your advertisement : Just the thing now the evenings are drawing in.	It is difficult to see how the compact feet of the sauropod could avoid becoming stuck fast in the soft, muddy bottom of a lake.	unchanged
become					Elinor was sometimes at a loss for the right word, or name, and then became impatient with herself; she was often frustrated because she couldn't move as swiftly as she did before.	He wandered restlessly about, and decided that the lie might as well become the truth.	unchanged
ensure					Fortunately, technical developments have ensured that the increase in computing power per unit cost has been growing at about an order of magnitude every 6 years over the last three decades.	King's Head, Fulham 4 Fulham High St, SW6 (736 1413) L-shaped room, part corridor, part bar, part dance-floor, with the stage in one corner, ensuring restricted view from virtually everywhere.	unchanged
know					and it does mean that they can relax you know about work and everything	The army never knows which it will be.	unchanged
tell					I'm afraid it's true, Mrs Carson told them.	A friend of mine says that her body tells her, without being asked, the season of the year.	unchanged
watch					You're going to watch Rosie and Jim dear.	Twice you've just I'm watching you two!	unchanged
think					When we've had half a whole, I'm thinking half a whole	We want everyone to be licensed, but the Government didn't think it necessary.	unchanged
justify					He became Robert of Jerusalem to his contemporaries; his deeds were recorded in the Song of Antioch; his pious bravery totally expunged the memory of Robert the Frisian's usurpation; and after his death his son Baldwin VII harped on his father's achievement to justify his substantial use of coercion against the enemies of the church.	Instead, he rationalized his thoughts and justified himself Adam probably indeed, almost certainly knew nothing about the find in the pine wood, but Adam had once owned the house and had thus taken on a responsibility.	unchanged
carry					Under his arm he carried a folded newspaper with that day's headline : PEACE MOTHER DIES.	Sir : On Saturday you published an advertisement for the 10 extra pages of news and features that you, The Independent, will carry from 2 October.	unchanged
involve					Those not involved find it difficult to gain very much from a presentation of a task description.	Are the German authorities involved ?	unchanged
mean					I mean I did have some of the boxes in there until I sort of, thought while I was sorting things out.	The name Grob Mitzer mean anything ?	unchanged
judge					It was, he judged, almost twenty feet long and obviously served the triple purpose of sitting room, working place and office.	There the similarity ends, since judging from his writings Bagehot was a roaring snob, whereas judging from his heckles the heckler was not.	unchanged
prepare					She sat down and prepared to wait as long as was necessary.	And I'm not prepared to go on paying three thousand a year renting it to give to him when I could be buying one myself.	unchanged
remain					The techniques just described are no more than guidelines in what remains the creative art of studying and describing what an experienced worker is doing or will be required to do.	But the concern with overcoming political marginality remained on the sidelines of the main public debate because it questioned the perception of the rioters as driven by irrational, uncivilized, and criminal instincts.	unchanged
set					Moreover, the advent of low-cost, high-density-storage devices like CD-ROMs may well make substantial data sets available even to those with modest computing power : a CD-ROM, for instance, can hold about 600 megabytes (i.e. 10&sup6; bytes), can be reproduced currently for about Ì´å£1 and read on a device costing about Ì´å£400.	If the PNC Declaration of Independence constituted a major landmark in this process, the time has come to embark on another major step, that of declaring the setting up of a state or government structure.	unchanged
include					DOZENS more East German refugees arrived outside the West German embassy yesterday seeking asylum and passage to the West, including some who missed by only a few minutes a train that took more than 800 of their compatriots to West Germany.	Is the cooker included or not ?	unchanged
state					However, Caithness himself stated that this first selection was in no way a definitive list	Finally, after the third month passed with no rent received, Debbie phoned the tenants, asked them to pay her directly, and sent Landlords a recorded-delivery letter, which was returned, and finally one by ordinary post stating that Landlords were no longer employed as the managing agents.	unchanged
sit					You could feel the atmosphere when you were sat in the car.	Way you go, Patty, he said softly, and the dog was off, hurling herself along the embankment, all paws and flying ears, after a rabbit who had been sitting in a patch of sun but disappeared with contemptuous ease as she came close.	unchanged
catch					Catch it, one two three catch it, one two three.	They offered opportunities for men of skill to acquire great position in the world Arnoul of Ardres caught the eye of Countess Ida of Boulogne through his exploits; and they also conferred lustre on the great Geoffrey le Bel and Philip of Alsace were throughout France for their distinguished performances in these show battles.	unchanged
provide					Nell would never rest until she could get closer to confirm her worst suspicions, and paradoxically it was the woman in her that provided the intensity of emotion that would let nothing stand in her way.	It is the doctor that provides the remedy.	unchanged
